{
  "$schema": "https://json-schema.org/draft/2020-12/schema",
  "title": "bonsai.lock/1",
  "description": "The lock (contract §14, spec §6): exactly which pack versions and files a workspace holds, so an update writes everything or nothing and an edit is never overwritten. Lives in the project at .bonsai/lock.json, committed, person-only. Written by Bonsai's engine (init, update); read by the engine, bonsai check (in CI, with no pack fetched), verifiers and people reading a diff; the studio reads it only through status --json. Keys sorted, forward slashes only, no absolute path anywhere. A writer writes every field below, in this order (contract §2.2); a reader treats a missing field as null, keeps an unknown one and refuses a duplicate key.",
  "type": "object",
  "required": [
    "format",
    "written_by",
    "packs",
    "files",
    "format0"
  ],
  "properties": {
    "format": {
      "description": "The version, always the first field (contract §2.2).",
      "examples": [
        "bonsai.lock/1"
      ],
      "const": "bonsai.lock/1"
    },
    "written_by": {
      "description": "The version of the Bonsai that wrote the lock.",
      "examples": [
        "1.0.0"
      ],
      "type": "string"
    },
    "packs": {
      "description": "Each pack in bonsai.yaml's order: its source, version, resolved commit, content hash, what it declares, and its folder in its repository.",
      "examples": [
        [
          {
            "id": "base",
            "source": "https://example.com/packs/base.git",
            "version": "1.0.0",
            "commit": "0a1b2c3d4e5f60718293a4b5c6d7e8f901a2b3c4",
            "sha256": "8d969eef6ecad3c29a3a629280e686cf0c3f5d5a86aff3ca12020c923adc6c92",
            "declares": {},
            "path": "packs/base"
          }
        ]
      ],
      "type": "array",
      "items": {
        "type": "object",
        "required": [
          "id",
          "source",
          "version",
          "commit",
          "sha256",
          "declares",
          "path"
        ],
        "properties": {
          "id": {
            "description": "The pack's id.",
            "examples": [
              "base",
              "workflow"
            ],
            "type": "string"
          },
          "source": {
            "description": "Where the pack is fetched from (a git URL).",
            "examples": [
              "https://example.com/packs/base.git"
            ],
            "type": "string"
          },
          "version": {
            "description": "The pack's version, from the tag bonsai.yaml names.",
            "examples": [
              "1.0.0"
            ],
            "type": "string"
          },
          "commit": {
            "description": "The tag's resolved 40-character commit (spec §5); a tag that later resolves elsewhere is refused.",
            "examples": [
              "0a1b2c3d4e5f60718293a4b5c6d7e8f901a2b3c4"
            ],
            "type": "string",
            "pattern": "^[0-9a-f]{40}$"
          },
          "sha256": {
            "description": "The pack's content hash, SHA-256 as 64 lowercase hex characters.",
            "examples": [
              "8d969eef6ecad3c29a3a629280e686cf0c3f5d5a86aff3ca12020c923adc6c92"
            ],
            "type": "string",
            "pattern": "^[0-9a-f]{64}$"
          },
          "declares": {
            "description": "What the pack declared at the locked commit, copied in so bonsai check runs in CI with no pack fetched (spec §6, §16 row 18): its kinds are the eight of format.DeclaresKeys (bonsai check --schema bonsai.lock prints them with the rest): lanes, documents, labels, protected, hooks, deny, needs and roles (set 8: pack.yaml's roles, each as bonsai.pack/1 writes it), in that order, and a key a newer Bonsai adds is kept. Their inner layout is not fixed, so it is typed open (formats/README.md). {} for a pack that declares nothing; a lock written before step 5.1.6 has no needs, which reads as the pack needing nothing, and one written before set 8 no roles, which reads as the pack declaring none.",
            "examples": [
              {},
              {
                "lanes": [
                  {
                    "name": "light",
                    "approve_first": false,
                    "close": "agent",
                    "description": "Small fixes and docs."
                  }
                ]
              }
            ],
            "type": "object"
          },
          "path": {
            "description": "The pack's folder inside its repository, as bonsai.yaml names it (forward slashes, no leading slash); null when the pack is the repository's root. Added in formats set 4, an addition: a lock written before has none, which a reader reads as unknown, not as the root, so a pack in a folder does not look moved after an upgrade and update judges that pack by its content hash alone, until the next update writes the path (step 5.1.5). With it, update sees a pack's folder change in bonsai.yaml itself, rather than only through content hashes, which miss file modes and submodules (step 5.1.1's verifier).",
            "examples": [
              "packs/base",
              null
            ],
            "type": [
              "string",
              "null"
            ],
            "pattern": "^[^/\\\\:][^\\\\:]*$"
          }
        }
      }
    },
    "files": {
      "description": "Every file Bonsai wrote, by project-relative path (forward slashes, keys sorted): its kind, the pack it came from, and the SHA-256 of its bytes with line endings made LF.",
      "examples": [
        {
          ".claude/settings.json": {
            "kind": "keys",
            "pack": "base",
            "sha256": "2c26b46b68ffc68ff99b453c1d30413413422d706483bfa0f98a5e886266e7ae"
          }
        }
      ],
      "type": "object",
      "propertyNames": {
        "pattern": "^[^/\\\\:][^\\\\:]*$"
      },
      "additionalProperties": {
        "type": "object",
        "required": [
          "kind",
          "pack",
          "sha256"
        ],
        "properties": {
          "kind": {
            "description": "How the engine treats the file (contract §14, spec §6), a closed list: pack (Bonsai's; an edit is a conflict), once (written once, then the project's), block (a marked region in a project-owned file), keys (Bonsai's own entries in a project-owned JSON file), kept (a pack file the person kept edited).",
            "examples": [
              "pack",
              "keys"
            ],
            "enum": [
              "pack",
              "once",
              "block",
              "keys",
              "kept"
            ]
          },
          "pack": {
            "description": "The id of the pack the file came from.",
            "examples": [
              "base"
            ],
            "type": "string"
          },
          "sha256": {
            "description": "SHA-256 of what Bonsai last wrote, line endings made LF, 64 lowercase hex characters.",
            "examples": [
              "2c26b46b68ffc68ff99b453c1d30413413422d706483bfa0f98a5e886266e7ae"
            ],
            "type": "string",
            "pattern": "^[0-9a-f]{64}$"
          }
        }
      }
    },
    "format0": {
      "description": "Every Bonsai-kind file without a format: line at link time (contract §2.3), by project-relative path, with the SHA-256 of its bytes after every line ending is made LF; {} when none. Such a file must stay on this list with this hash.",
      "examples": [
        {
          "work/runs/R-2026-09-30-T-0903.md": "fcde2b2edba56bf408601fb721fe9b5c338d10ee429ea04fae5511b68fbf8fb9"
        },
        {}
      ],
      "type": "object",
      "propertyNames": {
        "pattern": "^[^/\\\\:][^\\\\:]*$"
      },
      "additionalProperties": {
        "type": "string",
        "pattern": "^[0-9a-f]{64}$"
      }
    }
  }
}
